Grammar,Use,Meaning,Example,Link
（とい）ったらない,N・Aな・Aい・Vる＋...,No hay palabras para describir A (Enfasis o exageracion),みんなの前で転んで、恥ずかしいったらなかった,https://jlptsensei.com/learn-japanese-grammar/%e3%81%a8%e3%81%84%e3%81%a3%e3%81%9f%e3%82%89%e3%81%aa%e3%81%84-to-ittara-nai-meaning/
という,N＋ ... ＋N,Todas A sin excepcion,津波によって家という家が全て流されてしまった,https://jlptsensei.com/learn-japanese-grammar/n1-%e3%81%a8%e3%81%84%e3%81%86-to-iu-meaning-all-every/
というもの,N＋ ...,"Durante A, B (Parecido a の間に, pero mas reflexivo y formal)",この一週間というもの、そればっかりです,https://jlptsensei.com/learn-japanese-grammar/%e3%81%a8%e3%81%84%e3%81%86%e3%82%82%e3%81%ae-to-iu-mono-meaning/
というところだ・といったところだ,N＋ ...,Alrededor de/No mas de A (Cercanos al limite maximo),彼女は多くて見ても二十歳というところだ,https://jlptsensei.com/learn-japanese-grammar/%e3%81%a8%e3%81%84%e3%81%86%e3%81%a8%e3%81%93%e3%82%8d%e3%81%a0-%e3%81%a8%e3%81%84%e3%81%a3%e3%81%9f%e3%81%a8%e3%81%93%e3%82%8d%e3%81%a0-iu-tokoro-da-meaning/
というわけだ,sentence + ... ,"En resumen, A (Para concluir y resumir)",それが私たちの目標というわけだ,https://jlptsensei.com/learn-japanese-grammar/%e3%81%a8%e3%81%84%e3%81%86%e3%82%8f%e3%81%91%e3%81%a0-to-iu-wake-da-%e3%81%a8%e3%81%84%e3%81%86%e3%82%8f%e3%81%91%e3%81%a7%e3%81%99-meaning/
というわけではない,sentence + ... ,No se puede resumir como/No quiere decir que A,それは全く噓というわけではない,https://jlptsensei.com/learn-japanese-grammar/%e3%81%a8%e3%81%84%e3%81%86%e3%82%8f%e3%81%91%e3%81%a7%e3%81%af%e3%81%aa%e3%81%84-to-iu-wake-dewa-nai-meaning/
といわず~といわず,N＋ ... ＋N＋ ... ,"Ya se trate de A o B, C (Tanto a como B)",顔といわず、手といわず泥まみれだ,https://jlptsensei.com/learn-japanese-grammar/%e3%81%a8%e3%81%84%e3%82%8f%e3%81%9a%ef%bd%9e%e3%81%a8%e3%81%84%e3%82%8f%e3%81%9a-to-iwazu-to-iwazu-meaning/
ときている,N・Aな・Aい・Vる＋...,"Porque/Debido a que A, B (Se acompaña de ので・だから）",料理が美味しい上にサービスもいいときているから、客はいつも多い,https://jlptsensei.com/learn-japanese-grammar/%e3%81%a8%e3%81%bf%e3%82%8b%e3%81%a8-to-miru-to-meaning/
とみると,N・Aな・Aい・Vる＋...,"En cuanto se percibe/Tan pronto como se da cuenta de A, B",同僚は問題がちょっと難しいとみると、自分で考えないで人に聞く,https://jlptsensei.com/learn-japanese-grammar/%e3%81%a8%e3%81%bf%e3%82%8b%e3%81%a8-to-miru-to-meaning/
となると・となれば,N・Aな・Aい・Vる＋...,"Si se trata de/En caso de A, B",今年、JLPTN1を受けるとなると、今の2倍は勉強しなければならない,https://jlptsensei.com/learn-japanese-grammar/%e3%81%a8%e3%81%aa%e3%82%8b%e3%81%a8-%e3%81%a8%e3%81%aa%e3%82%8c%e3%81%b0-%e3%81%a8%e3%81%aa%e3%81%a3%e3%81%9f%e3%82%89-to-naru-to-nareba-meaning/
とされる・とされている,sentence + ... ,A-1 se considera/es reconocido como A,彼のやったことは法律違反とされる,https://jlptsensei.com/learn-japanese-grammar/%e3%81%a8%e3%81%95%e3%82%8c%e3%82%8b-%e3%81%a8%e3%81%95%e3%82%8c%e3%81%a6%e3%81%84%e3%82%8b-to-sareru-meaning/
ときたら,N＋ ... ,"En cuanto a A, B (Expresar sorpresa/admiracion/frustracion)",私の息子ときたら、もうすぐ試験なのに遊んでいるばかりいるんですよ,https://jlptsensei.com/learn-japanese-grammar/%e3%81%a8%e3%81%8d%e3%81%9f%e3%82%89-tokitara-meaning/
ところを,N＋の・Aな・Aい・Vる＋...,"Justo cuando/Mientras A, B (Interrupcion o cambio)",忙しいところをお集まりいただき、ありがとうございます,https://jlptsensei.com/learn-japanese-grammar/%e3%81%a8%e3%81%93%e3%82%8d%e3%82%92-tokoro-o-meaning/
ともあろうものが,N＋ ... ,"De todos, alguien como A, B (Mal comportamiento de alguien importante)",社長ともあろうものが、遅刻なんてあり得ないよ,https://jlptsensei.com/learn-japanese-grammar/%e3%81%a8%e3%82%82%e3%81%82%e3%82%8d%e3%81%86%e3%82%82%e3%81%ae%e3%81%8c-tomo-arou-mono-ga-meaning/
ともなく・ともなしに,Vる＋...｜疑問詞＋...,A se hace sin intencion particular｜No se esta claro de A (2 significados),休みの日にはどこへ行くともなしにドライブすることが多い,https://jlptsensei.com/learn-japanese-grammar/%e3%81%a8%e3%82%82%e3%81%aa%e3%81%8f-%e3%81%a8%e3%82%82%e3%81%aa%e3%81%97%e3%81%ab-tomo-naku-meaning/
ともすれば,... + sentence,A tiene la tendencia de/a menudo B,政府はともすればマスメディアを統制すたがる,https://jlptsensei.com/learn-japanese-grammar/%e3%81%a8%e3%82%82%e3%81%99%e3%82%8c%e3%81%b0-tomo-sureba-meaning/
とも~とも,N・A・Vる＋ ... ＋N・A・Vる＋ ... ,No se puede decir/juzgar si A o B,それは正しいとも、間違っているとも言えない,https://jlptsensei.com/learn-japanese-grammar/%e3%81%a8%e3%82%82%ef%bd%9e%e3%81%a8%e3%82%82-tomo-tomo-meaning/
とりわけ,... + sentence,(A) En particular/Especialmente B,彼女はとりわけ音楽が好き,https://jlptsensei.com/learn-japanese-grammar/%e3%81%a8%e3%82%8a%e3%82%8f%e3%81%91-toriwake-meaning/
としたことが,N＋ ... ,"Para ser A, B (Decepcion o sorpesa ante una accion inesperada)",大学生としたことが、こんな問題も答えられないなんて,https://jlptsensei.com/learn-japanese-grammar/%e3%81%a8%e3%81%97%e3%81%9f%e3%81%93%e3%81%a8%e3%81%8c-toshita-koto-ga-meaning/
とっさに,... + sentence,(Cuando A) Instantaneamente/de inmediato B (Accion/Reflejo rapido),地震が起きた時にとっさにテーブルの下に逃げた,https://jlptsensei.com/learn-japanese-grammar/%e3%81%a8%e3%81%a3%e3%81%95%e3%81%ab-tossa-ni-meaning/
とて,N＋ ... ,"Incluso A, B (No hay excepcion)",母親とて、彼の本当の気持ちは理解できないだろう,https://jlptsensei.com/learn-japanese-grammar/%e3%81%a8%e3%81%a6-tote-particle-meaning/
とは,N・Aな・Aい・Vる＋...,"Que A (, B) (Expresar sorpresa o incrudulidad ante algo)",妹の結婚式に出られないとは、残念な限りだ,https://jlptsensei.com/learn-japanese-grammar/%e3%81%a8%e3%81%af-towa-meaning/
とはいえ,N・Aな・Aい・Vる＋...,"Aunque A, B (Se usa para reconocer verdades)",教師とはいえ、答えられないこともある,https://jlptsensei.com/learn-japanese-grammar/%e3%81%a8%e3%81%af%e3%81%84%e3%81%88-towa-ie-meaning/
とは比べものにならない,N＋ ... ,A no es comparable con A-1 (Estan en niveles diferentes),私の料理は母の料理とは比べものにならない,https://jlptsensei.com/learn-japanese-grammar/%e3%81%a8%e3%81%af%e6%af%94%e3%81%b9%e3%82%82%e3%81%ae%e3%81%ab%e3%81%aa%e3%82%89%e3%81%aa%e3%81%84-towa-kurabemono-ni-naranai-meaning/
とは打って変わって・とは打って変わり,N＋ ... ,"Al contrario que A, B (B y A son completamente opuestos)",父は若い時とは打って変わって、とても優しくになった,https://jlptsensei.com/learn-japanese-grammar/%e3%81%a8%e3%81%af%e6%89%93%e3%81%a3%e3%81%a6%e5%a4%89%e3%82%8f%e3%81%a3%e3%81%a6-%e3%81%a8%e3%81%af%e6%89%93%e3%81%a3%e3%81%a6%e5%a4%89%e3%82%8f%e3%82%8a-towa-utte-kawatte-meaning/
つ~つ,Vます（ます）＋ ... ＋Vます（ます）,A y B (Alternando A y B) (Dos acciones que se realizan alternativamente),どうしても欲しいゲームがあって、店の前を行きつ戻りつした,https://jlptsensei.com/learn-japanese-grammar/%E3%81%A4%EF%BD%9E%E3%81%A4-tsu-tsu-meaning/
尽くす,Vます（ます）＋ ...,A se hace hasta agotarse/el fin (Dedicacion completa),私は常に自分のベストをし尽くすようにしている,https://jlptsensei.com/learn-japanese-grammar/%E5%B0%BD%E3%81%8F%E3%81%99-%E3%81%A4%E3%81%8F%E3%81%99-tsukusu-meaning/
ってば・ったら,sentence + ... ,"A ya se sabe/ha dicho (Molestia)｜Cuando se trada de A, B (Suele ser malo)",本当だってば。彼女を見たんだ！,https://jlptsensei.com/learn-japanese-grammar/%e3%81%a3%e3%81%a6%e3%81%b0-%e3%81%a3%e3%81%9f%e3%82%89-tteba-ttara-meaning/
にうちに入らない,N＋の・Aな・Aい・Vる＋...,A-1 no cuenta como/no se puede decir que sea A,日本語はちょっと難しいですが、世界で一番難しいの言語のうちに入らない,